{
  "title": "Алонсо",
  "Раса": "Редгард",
  "Фракция": "Чёрный лук",
  "Локация": "Телепе",
  "Квест": "Рыцари Белого жеребца",
  "Услуги": null,
  "Состояние": null,
  "categories": "Персонажи, Oblivion, Мужчины, Редгарды, Чёрный лук",
  "text": "Алонсо (ориг. Alonzo) — персонаж в игре The Elder Scrolls IV: Oblivion.\n Алонсо — редгард, один из боссов бандитов и член банды «Чёрный Лук». Вместе со своими товарищами, Чёрным Бруго и Рокси, промышляют грабежами около айлейдских руин, Телепе. Главный герой не сможет побеседовать с Алонсо, так как тот не вступает в диалог и настроен исключительно агрессивно.\n Алонсо защищён уровневыми лёгкими доспехами, под которыми носит дешёвую одежду. Из оружия использует фирменный «Чёрный лук» банды. Не использует какие-либо заклинания и не носит с собою драгоценности или деньги.\n Каждый день Алонсо прогуливается возле руин или внутри них, не прерываясь на сон или приёмы пищи. Когда квест «Рыцари Белого жеребца» будет взят, он будет держаться поближе к Рокси и стараться защитить его.\n"
}