{
  "title": "Араве",
  "Раса": "Альтмер",
  "Фракция": "Первый Альдмерский Доминион",
  "Локация": "Лощина Оркея",
  "Квест": "Морозец",
  "Услуги": null,
  "Состояние": "Проекция",
  "categories": "Персонажи, Online, Женщины, Альтмеры, Проекции, Первый Альдмерский Доминион",
  "text": "Араве (ориг. Arawe) — персонаж в игре The Elder Scrolls Online.\n Араве великолепна, правда? Так ярко блестит!— Бримлор Араве — альтмерка, боец Альдмерского Доминиона, в составе небольшой разведывательной группы высаженная на острове Стылая Скала. Шпионы укрылись в пещере лощина Оркея, откуда начали наблюдать за действиями располагавшегося на острове гарнизона Эбонхартского Пакта, однако спустя какое-то время их обнаружили солдаты Тилрани. В ходе начавшегося боя и последовавшего за ним обвала погибли все члены разведывательного отряда за исключением Бримлора, который сумел продержаться некоторое время, питаясь кореньями, которые находил в пещере, пока холод и яд, содержавшийся в корнях, убили и его, предварительно сведя с ума. Но Бримлор был довольно сильным магом и его дух остался в лощине Оркей. Обезумевший босмер стал убивать входивших в пещеру местных жителей и был прозван обитателями Стылой Скалы Морозцем. Души своих погибших товарищей Морозец запечатал в различных вещах, в частности, дух Араве был заключён им в канделябр, находящейся в самом северном зале пещеры. Когда спустя десять лет после произошедших в лощине Оркея событий это место посетит Бездушный, он сможет вызвать дух Араве, дотронувшись до этого канделябра. Впрочем, скорее всего, это не душа альтмерки, а всего лишь магическая проекция, созданная обезумевшим от поедания ядовитых корней и одиночества Бримлором, поскольку Араве никак не реагирует на происходящее.\n"
}