{
  "title": "Борри",
  "Раса": "Старший",
  "Фракция": "Седобородые",
  "Локация": "Высокий Хротгар",
  "Квест": "Путь Голоса",
  "Услуги": "Учитель Криков",
  "Состояние": null,
  "categories": "Персонажи, Skyrim, Мужчины, Старшие, Седобородые",
  "text": "Борри (ориг. Borri) — персонаж в игре The Elder Scrolls V: Skyrim.\n Борри — один из престарелых затворников-Седобородых, последователей Пути Голоса, живущих в монастыре Высокий Хротгар. Он — один из наставников Довакина на его пути Драконорождённого, обучающий использованию этого дара. Борри обучает протагониста Крику «Стремительный рывок» при прохождении основной сюжетной линии по квесту «Путь Голоса». Как и остальные Седобородые (кроме Арнгейра) не способен к полноценному диалогу и может лишь едва слышно прошептать «Довакин», даже этим вызывая небольшие землетрясения.\n День Борри начинается в 4 часа утра, когда он встаёт с одной из кроватей в спальне монастыря. Затем он начинает медитировать внутри монастыря, каждый час переходя в другое место. В 12:30 он будет медитировать во дворе, а также в башне, изредка используя крик «Чистое небо», пока находится там. В 16:30 он начнёт медитировать перед святыней в главном зале входа, а в 8 вечера — в главном зале у входа, каждый час меняя свою позицию по часовой стрелке, пока не закончит в 00:30, чтобы почитать книгу; затем он ложится спать в 2 часа ночи. Борри спит всего два часа.\n Борри одет в одеяние Седобородых в виде тёмной рясы, расшитой узорами. Обут в короткие матерчатые сапоги Седобородых тёмного оттенка в тон рясе. На голове у него капюшон Седобородых. Также у него при себе есть флейта, зубы ледяного привидения, амулет Талоса и снежные ягоды.\n По игровой классификации Борри является жрецом (ориг. Priest). Эта специализация подразумевает высокий уровень таких навыков, как  «Красноречие» и «Восстановление». Также неплохо развиты «Кузнечное дело», «Алхимия» и «Колдовство». Наименьший приоритет в развитии получает «Зачарование». Остальные навыки развиты лишь в силу расовых склонностей, но так как Борри относится к технической расе «Старший», которая не имеет бонусов в развитии навыков, то у него не развито более ничего, кроме вышеперечисленного. Никакими способностями Борри не обладает, но имеет в своём распоряжении набор различных Криков, на которые и рассчитывает в бою, так как не пользуется оружием. Известные Крики и навыки, имеющие уровень выше базового, указаны в таблицах ниже.\n После того, как протагонист достигнет монастыря, явившись на зов Седобородых, Борри вместе с другими Седобородыми поучаствует в проверке способностей главного героя, испытывая на себе силу его Голоса. После этого Седобородые начнут обучать Довакина Словам Силы Криков «Безжалостная сила» и «Стремительный рывок».\n По завершении всех испытаний Седобородых и после того, как из Устенгрева будет доставлен рог Юргена Призыватель Ветра, главного героя обучат последнему Слову Силы Крика «Безжалостная сила» — «Да», — что значит «Толкать». В роли наставника выступит мастер Вульфгар. Затем Седобородые признают главного героя Довакином во всеуслышание — проведут особый ритуал, в ходе которого все старцы проговорят ритуальные слова на драконьем языке, а Довакину будет необходимо выстоять против их неукротимого Голоса. Речь Седобородых на драконьем и в переводе доступна ниже, под кнопкой-спойлером.\n \nПомимо этого, Борри вместе с остальными Седобородыми присутствует во время обучения Довакина Крику «Чистое небо», перед тем как тот отправится на встречу с Партурнаксом. Также Борри присутствует на мирных переговорах в ходе гражданской войны.\n"
}