{
  "title": "Гастон Ашам",
  "Раса": "Бретон",
  "Фракция": "Кроворождённые",
  "Локация": "Липсанд-Тарн",
  "Квест": null,
  "Услуги": null,
  "Состояние": "Вампир",
  "categories": "Кроворождённые, Online, Персонажи, Мужчины, Бретоны, Вампиры, Боссы",
  "text": "Гастон Ашам (ориг. Gaston Ashham) —  босс в игре The Elder Scrolls Online.\n Гастон Ашам — бретон-вампир, вместе со своей сестрой Раллиной возглавляющая шайку вампиров под названием «Кроворождённые», действующую в центральном Сиродиле времён войны альянсов, хотя сами Ашамы родом из Вэйреста и перебраться в эти края их вынудили лишь приказы некоего господина. Согласно его же приказам брат и сестра разделились. Первый должен был собрать армию в айледйских руинах Липсанд-Тарне, а вторая — в Подзавесной пещере. После того, как «Кроворождённые» собрали бы достаточно сил, они должны были зачистить весь северный Сиродил. Найти Гастона можно в северном зале этого логова, рядом с освящённым велкиндскими камнями столом.\n Закованный в рыцарские доспехи Гастон является по своему игровому классу «повелителем мертвецов». Также, будучи вампиром, он использует навык «вытягивание сущности».\n При обыске останков Гастона можно найти: случайное оружие, элементы брони, ювелирные изделия (как стандартные, так и из наборов Сиродила, в том числе уникальную кирасу из набора «Герб Сиродила») от обычного до эпического качества, глифы, пустые и заполненные камни душ, уровневые яды и зелья, золото, а также зацепку для нахождения магических металлических пластин, являющихся частью уникальных сапог «Снегоходы».\n Существует несколько достижений, связанных с этим персонажем:\n"
}