{
  "title": "Глядит-сквозь-Стекло",
  "Раса": "Аргонианин",
  "Фракция": "Варакун",
  "Локация": "Святилище Чёрной Пасти",
  "Квест": null,
  "Услуги": null,
  "Состояние": "Вампир",
  "categories": "Варакун, Online, Персонажи, Женщины, Аргониане, Вампиры, Боссы",
  "text": "Глядит-сквозь-Стекло (ориг. Peers-Through-Glass) —  босс в игре The Elder Scrolls Online.\n Глядит-сквозь-Стекло — аргонианка-вампир, одна из предводительниц занявшего айлейдские руины Святилище Чёрной Пасти клана Варакун. Она находится в самом центре этого подземелья, рядом с неработающим айлейдским колодцем. Рядом на ступенях лежит «Манифест свободного аргонианина», это позволяет предположить, что автором этого документа является сама Глядит-сквозь-Стекло и что именно она привела клан Варакун в эти руины для уничтожения обосновавшихся здесь данмерских работорговцев.\n По игровой классификации Глядит-сквозь-Стекло является магом-разрывателем времени (ориг. Time Bomb Mage) и в бою использует способности этого класса «Сияние энтропии», «Пустота» и «Поглощение сущности». Кроме того, ей будут помогать два стоящих рядом вампира, один из которых является криомантом, а второй — бойцом ближнего боя.\n При обыске останков Глядит-сквозь-Стекло можно найти: случайное оружие, элементы брони, ювелирные изделия (в том числе и из наборов Тенетопи, включая уникальное ожерелье «Сущность скорлупы детеныша» из набора «Скорлупа детёныша».) от обычного до эпического качества, глифы, пустые и заполненные камни душ, уровневые яды и зелья, золото. Также с небольшим шансом при обыске останков вампирши можно найти зацепку для нахождения зубов акулы пад-са, необходимых для создания уникального шлема «Взгляд Ситиса».\n Существует несколько достижений, связанных с этим персонажем:\n"
}