{
  "title": "Комендант Вестон",
  "Раса": "Имперец",
  "Фракция": "Забытые",
  "Локация": "Забытая цитадель",
  "Квест": null,
  "Услуги": null,
  "Состояние": "Зомби",
  "categories": "Забытые, Dragonhold, Персонажи, Мужчины, Имперцы, Зомби, Боссы",
  "text": "Комендант Вестон (ориг. Commandant Weston) —  босс в дополнении The Elder Scrolls Online: Dragonhold.\n \n Комендант Вестон — имперец, возможно, последний руководитель Топальской академии легионеров, одного из известнейших в прошлом учебных заведений Имперского легиона. Ныне это обходимое местными десятой дорогой давно заброшенное укрепление, расположенное на северо-востоке Пеллитина, известно как Забытая цитадель. Причиной того, что место оказалось заброшенным и проклятым, был Кнахатенский грипп. Прошлую глобальную эпидемию, Трассианскую чуму, академия смогла пережить просто закрыв все входы и выходы[1] и руководство учебного заведения полагало, что данная тактика сработает и в этот раз, однако новая болезнь была более заразной. В отчаяние боевые маги академии, Янон Инвель и Гонория Гаррана, решают провести очень опасный и балансирующий на грани некромантии ритуал, который должен был бы повлиять на души и тела обитателей этого места, сделав их на время неуязвимыми к болезни. Но в последний момент Гонория, испугавшись за душу своей ещё нерождённой дочери, сбежала из академии, к тому же забрав с собой уже приготовленный для ритуала артефакт, каковым являлся подаренный ей когда-то Яноном медальон. В отчаяние Инвель попытался повести обряд с тем, что было у него на руках, но все его попытки потерпели крах, причём с каждой неудачей проклятие лишь усиливалось. Легионеры один за другим умирали от гриппа. Заклинание оказалось слишком слабым, чтобы защитить их плоть, но слишком сильным, чтобы дать им уйти. В итоге их души и тела остались здесь и теперь бродят по коридорам бывшей академии, став особой разновидностью зомби, так называемыми Забытыми. Самым сильным среди них является бывший комендант Топальской академии, Вестон. Найти его можно на первом этаже главного лектория, отдельно стоящего здания, находящегося в северной части двора Забытой цитадели. Вестон является боссом этого логова.\n Вестон является зомби лишь по состоянию, а не по способностям. В бою этот одетый в доспехи, изготовленные в стиле ордена Часа и вооружённый секирой воин использует способности класса «устранитель»: «ледяная клетка», «быстрый удар», «нейтрализация магии» и «апперкот». На помощь Вестону часто приходят другие Забытые различных классов.\n При обыске останков Вестона можно найти: случайное оружие, элементы брони, ювелирные изделия (как стандартные, так и из наборов Южного Эльсвейра) от обычного до эпического качества, пустые и заполненные камни душ, уровневые яды, глифы и зелья, золото.\n Существует несколько достижений, связанных с этим персонажем:\n"
}