{
  "title": "Марбита",
  "Раса": "Редгард",
  "Фракция": "Кроворождённые",
  "Локация": "Липсанд-Тарн",
  "Квест": null,
  "Услуги": null,
  "Состояние": "Вампир",
  "categories": "Кроворождённые, Online, Персонажи, Женщины, Редгарды, Вампиры, Боссы",
  "text": "Марбита (ориг. Marbita) —  босс в игре The Elder Scrolls Online.\n Марбита — редгардка-вампир, вместе с Гастоном Ашамом возглавляющая силы группировки «Кроворождённые», занявшей старые айлейдские подземелья Липсанд-Тарн на северо-западе Сиродила. Найти её можно в западном зале этого логова.\n Марбита вооружена щитом и булавой и по своему игровому классу является «потрошителем». В бою использует следующие способности:\n При обыске останков Марбиты можно найти: случайное оружие, элементы брони, ювелирные изделия (как стандартные, так и из наборов Сиродила, в том числе уникальный шлем из набора «Герб Сиродила») от обычного до эпического качества, глифы, пустые и заполненные камни душ, уровневые яды и зелья, золото, а также зацепку для нахождения магических металлических пластин, являющихся частью уникальных сапог «Снегоходы».\n Существует несколько достижений, связанных с этим персонажем:\n"
}