{
  "title": "Ориэлль",
  "Раса": "Босмер",
  "Фракция": "Первый Альдмерский Доминион",
  "Локация": "Лощина Оркея",
  "Квест": "Морозец",
  "Услуги": null,
  "Состояние": "Проекция",
  "categories": "Персонажи, Online, Мужчины, Босмеры, Проекции, Первый Альдмерский Доминион",
  "text": "Ориэлль (ориг. Oriell) — персонаж в игре The Elder Scrolls Online.\n Это Ориэлль. Мы братья! Только я симпатичнее— Бримлор Ориэлль — босмер, боец Альдмерского Доминиона, в составе небольшой разведывательной группы высаженный на острове Стылая Скала. Шпионы укрылись в пещере лощина Оркея, откуда начали наблюдать за действиями располагавшегося на острове гарнизона Эбонхартского Пакта, однако спустя какое-то время их обнаружили солдаты Тилрани. В ходе начавшегося боя и последовавшего за ним обвала погибли все члены разведывательного отряда за исключением брат Ориэлля Бримлора, который сумел продержаться некоторое время, питаясь кореньями, которые находил в пещере, пока холод и яд, содержавшийся в корнях, убили и его, предварительно сведя с ума. Но Бримлор был довольно сильным магом и его дух остался в лощине Оркей. Обезумевший босмер стал убивать входивших в пещеру местных жителей и был прозван обитателями Стылой Скалы Морозцем. Души своих погибших товарищей Морозец запечатал в различных вещах, в частности, дух Ориэлля был заключён им в кувшин, находящейся в самом северном зале пещеры. Когда спустя десять лет после произошедших в лощине Оркея событий это место посетит Бездушный, он сможет вызвать дух Ориэлля, дотронувшись до этого кувшина. Впрочем, скорее всего это лишь магическая проекция, созданная обезумевшим от поедания ядовитых корней и одиночества Бримлором, поскольку Ориэлль никак не реагирует на происходящее.\n"
}