{
  "title": "Тарак",
  "Раса": "Каджит",
  "Фракция": "Первый Альдмерский Доминион",
  "Локация": "Лощина Оркея",
  "Квест": "Морозец",
  "Услуги": null,
  "Состояние": "Проекция",
  "categories": "Персонажи, Online, Мужчины, Каджиты, Проекции, Первый Альдмерский Доминион",
  "text": "Тарак (ориг. Tarak) — персонаж в игре The Elder Scrolls Online.\n Тарак из Серебряного Когтя! Он всегда шутил. В облике вазы ему куда веселее!— Бримлор Тарак — каджит из клана Серебряного Когтя, боец Альдмерского Доминиона, в составе небольшой разведывательной группы высаженный на острове Стылая Скала. Шпионы укрылись в пещере лощина Оркея, откуда начали наблюдать за действиями располагавшегося на острове гарнизона Эбонхартского Пакта, однако спустя какое-то время их обнаружили солдаты Тилрани. В ходе начавшегося боя и последовавшего за ним обвала погибли все члены разведывательного отряда за исключением Бримлора, который сумел продержаться некоторое время, питаясь кореньями, которые находил в пещере, пока холод и яд, содержавшийся в корнях, убили и его, предварительно сведя с ума. Но Бримлор был довольно сильным магом и его дух остался в лощине Оркей. Обезумевший босмер стал убивать входивших в пещеру местных жителей и был прозван обитателями Стылой Скалы Морозцем. Души своих погибших товарищей Морозец запечатал в различных вещах, в частности, дух Тарака был заключён им в даэдрической вазе, находящейся в самом северном зале пещеры. Когда спустя десять лет после произошедших в лощине Оркея событий это место посетит Бездушный, он сможет вызвать дух Тарака, дотронувшись до этой вазы. Впрочем, скорее всего это просто магическая проекция, созданная обезумевшим от поедания ядовитых корней и одиночества Бримлором, поскольку Тарак никак не реагирует на происходящее.\n"
}