{
  "title": "Хутерн",
  "Раса": "Айлейд",
  "Фракция": "Проекции",
  "Локация": "Ксанмир Вакка-Бок",
  "Квест": "Реликт Аргона",
  "Услуги": null,
  "Состояние": null,
  "categories": "Персонажи, Murkmire, Мужчины, Айлейды, Проекции",
  "text": "В данной статье используется неофициальный вариант перевода. Если вы видите это предупреждение, пожалуйста, ознакомьтесь с инструкцией, замените текст на соответствующий официальной локализации и уберите данный шаблон.\n Хутерн (ориг. Houtern) — персонаж в дополнении The Elder Scrolls Online: Murkmire.\n Хутерн — айлейдский маг (из племени барсебиков), служивший королю Миндхалю, одержимому идеей найти Реликт Аргона и раскрыть тайны магии Хиста. Служа своему владыке, Хутерн создал особое место между мирами — Эльд Ангавар (Старое железное дерево на айлейдуне) — план связующих врат, соединённых левитирующими айлейдскими сооружениями. По задумке авторов врат, рано или поздно они должны были привести их к Реликту Аргона и к Хисту, но их надежды не оправдались. Хутерн замучил бессчётное число аргониан в надежде понять природу этой расы, но и здесь потерпел неудачу. В конце концов он пришёл к выводу, что следует использовать для врат не велкиндские камни, а аргонианские камни вакка. Он смог приспособить подобный кристалл для своих нужд, но раскрыть остальные тайны народа Чернотопья, по-видимому, уже не успел.\n Бездушный, преследующий Кассандру, также пытающуюся завладеть Реликтом, через ксанмир Вакка-Бок сможет попасть в Эльд Ангавар. Следуя по его бесконечным переходам от одних врат к другим, он увидит проекции Хутерна и Миндхаля, их отпечатавшиеся во времени образы, и услышит беседы, которые они вели тысячи лет назад:\n \n \n \n \n \n После этого диалога Хутерн и Миндхаль уходят к связующим вратам и исчезают.\n"
}