{
  "title": "Эйджа",
  "Раса": "Норд",
  "Фракция": "Скинград",
  "Локация": "Скинград, Коловианские торговцы, Розеторн-Холл",
  "Квест": "Помощница",
  "Услуги": "Пирог пастуха и мёд Розеторна",
  "Состояние": null,
  "categories": "Персонажи, Oblivion, Женщины, Норды, Скинград, Персонажи (Скинград)",
  "text": "Эйджа (ориг. Eyja) — персонаж в игре The Elder Scrolls IV: Oblivion.\n Эйджа — молодая нордка, прислуживающая в магазине «Коловианские торговцы». Эта неулыбчивая девушка почти не разговаривает с посетителями, разве что может поделиться городскими сплетнями или свежими слухами о Глартире.\n Кроме этого она может помочь герою в выполнении некоторых заданий, сделав небольшие подсказки. Например, направив к Шуму гро-Йаругу, дворецкому в замке Скинград, если герою нужно будет проникнуть в тюрьму замка в ходе квеста Гильдии воров «Утраченные истории»: «Иногда они набирают людей для работы в замке. Но мало кто соглашается идти. Попробуй поговорить с дворецким, Шумом гро-Йаругом». Или поспособствовав в поиске Маглира, когда он будет нужен герою по заданию Гильдии бойцов «Незаконченное дело»: «А, он. Он где-то здесь. Обычно он торчит в „Западном вельде“, уставившись на дно кружки с элем».\n Ситуация изменится, когда герой приобретёт Розеторн-Холл и придёт к Гандеру за обстановкой для нового дома. Вскоре после того, как будет приобретена обстановка для комнаты прислуги, Эйджа сама подойдёт к протагонисту и предложит свои услуги: «Привет, я слышала, тобою куплена обстановка для комнат прислуги в Розеторн-Холле. Я вот подумала, может ты будешь нанимать кого-нибудь на эту работу? За 150 золотых и крышу над головой, я твоя. Ну, помощница по дому, я это имею в виду». Если отказать ей, она смиренно скажет: «Хорошо. Но если передумаешь, я буду здесь». Но если согласиться на это заманчивое предложение, то радости девушки не будет предела: «Превосходно! Я сейчас же перееду к тебе!» Она и в самом деле, даже не попрощавшись с Гандером, тут же поспешит в Розеторн-Холл, говоря лишь: «Я не могла дождаться… Наконец-то я вдали от этого кошмарного магазина».\n Оставив службу в «Коловианских торговцах», Эйджа повеселеет и станет более разговорчивой. Тогда и можно будет узнать невесёлую историю её жизни. Если попросить Эйджу рассказать о себе, она ответит: «Я? Мне, в общем-то, нечего рассказать о себе. Я рано осиротела и даже не помню, кто были мои родители. Но меня это не очень-то печалит. Это было так давно. Гандер взял меня к себе, когда я была еще подростком, и с тех пор я жила здесь. Мы… делили одну постель… но так и не поженились. Он никогда не был жесток со мной, но и ласков не был. Я для него была просто частью его магазина. Но теперь все стало по-другому. Я рада, что теперь служу тебе. Я уверена, что мы поладим!»\n С этих пор Эйджа будет радостно приветствовать героя, когда он придёт в свой дом: «Добрый вечер, милорд (миледи)». Если герой станет вампиром, Эйджа заметит это, но не проявит агрессии: «Что-то, похоже… с тобой неладно, милорд (миледи)». Заболевшего хозяина девушка встретит словами: «Ты выглядишь не очень хорошо, милорд (миледи). Возможно, тебе нужно отдохнуть». И тепло попрощается, когда герой завершит разговор: «Удачи тебе, милорд (миледи)». Но помимо приятных слов от прислуги в доме есть реальная польза. Герой может попросить у Эйджи еду или питьё, на что она радостно откликнется: «Конечно! Вот, пожалуйста. Пастуший пирог… мой собственный рецепт» или «Конечно! Вот, пожалуйста. Этот отличный мёд позволит тебе расслабиться». После этих реплик в инвентарь героя добавятся пирог пастуха и мёд Розеторна соответственно. Правда, для того чтобы получить от прислуги еду и питьё, в доме должна быть кухня, в противном случае Эйджа скажет только: «Я бы с радостью приготовила, но у нас нет кухни».\n Всегда одета в красную льняную рубашку, красную одежду и туфли из коровьей кожи. При себе имеет 4–6 монет и ключ от «Коловианских торговцев». Как только Эйджа будет нанята на работу в Розеторн-Холл, в её карманах появится ключ от особняка. Эйджа не имеет при себе оружия и не знает ни одного заклинания, так что сражаться, при необходимости, будет голыми руками.\n Пока Эйджа живёт в «Коловианских торговцах», она будет прогуливаться каждый вечер с 6 до 8 часов в районе зданий Гильдии бойцов и Гильдии магов. После чего направится на постоялый двор «Две сестры», где и будет ужинать до 10 часов вечера. Всё остальное время она проведёт, слоняясь по магазину. В этот период она никогда не спит.\n Когда девушка переедет в Розеторн-Холл, у неё наконец появится своя кровать, на которой она будет спать с полуночи до 7 утра, а с 9 утра до полудня присядет к столу, стоящему у её кровати. Оставшееся время она будет прогуливаться по первому этажу особняка. В этот период она никогда не ест.\n"
}